{
  "version": 1,
  "id": "llm",
  "title": "LLM은 어떻게 작동하나요?",
  "description": "입력 문장이 토큰과 벡터를 거쳐 답변이 되는 과정, 그리고 그 계산을 가능하게 하는 학습을 살펴봅니다.",
  "color": "lime",
  "nodes": [
    {
      "status": "exploring",
      "tags": [],
      "id": "language-model",
      "title": "LLM은 어떻게 작동하나요?",
      "summary": "생성형 언어 모델은 지금까지의 문맥으로 다음 토큰을 예측합니다. 문장을 숫자로 바꾸고, 문맥을 계산하고, 토큰을 하나씩 이어 붙이는 과정을 살펴봅니다.",
      "kind": "group",
      "position": {
        "x": 0,
        "y": 0
      },
      "size": {
        "width": 1700,
        "height": 1060
      },
      "document": "language-model.md"
    },
    {
      "status": "exploring",
      "tags": [],
      "id": "tokenization",
      "title": "토큰화 — 문장을 ID로",
      "summary": "입력 문장을 모델의 어휘에 맞는 작은 조각으로 나누고, 각 조각을 정수 ID로 바꿉니다. 토큰은 한 단어일 수도, 단어의 일부일 수도 있습니다. 이 단계에서는 아직 문맥의 의미를 계산하지 않습니다.",
      "kind": "concept",
      "position": {
        "x": 40,
        "y": 180
      },
      "parentId": "language-model",
      "document": "tokenization.md"
    },
    {
      "status": "exploring",
      "tags": [],
      "id": "embedding",
      "title": "임베딩 — ID를 벡터로",
      "summary": "토큰 ID에 해당하는 숫자 벡터를 학습된 표에서 꺼냅니다. 벡터는 신경망이 계산할 수 있는 표현입니다. 토큰의 순서를 구별하는 위치 정보도 모델 구조에 맞게 반영합니다.",
      "kind": "concept",
      "position": {
        "x": 460,
        "y": 180
      },
      "parentId": "language-model",
      "document": "embedding.md"
    },
    {
      "status": "exploring",
      "tags": [],
      "id": "transformer",
      "title": "Transformer — 문맥 계산",
      "summary": "여러 층을 지나며 각 토큰의 벡터에 앞선 문맥을 반영합니다. 어텐션은 토큰 사이의 정보를 모으고, FFN은 각 위치의 표현을 변환합니다. 같은 토큰도 문맥에 따라 다른 표현을 갖게 됩니다.",
      "kind": "concept",
      "position": {
        "x": 880,
        "y": 180
      },
      "parentId": "language-model",
      "document": "transformer.md"
    },
    {
      "status": "exploring",
      "tags": [],
      "id": "generation",
      "title": "생성 — 예측하고 이어 쓰기",
      "summary": "마지막 위치의 표현을 어휘 전체의 점수와 확률로 바꾸고 다음 토큰을 선택합니다. 선택한 토큰을 문맥에 붙인 뒤 같은 계산을 반복합니다. 종료 토큰이나 길이 제한에 도달하면 생성을 멈춥니다.",
      "kind": "concept",
      "position": {
        "x": 1300,
        "y": 180
      },
      "parentId": "language-model",
      "document": "generation.md"
    },
    {
      "status": "exploring",
      "tags": [],
      "id": "attention",
      "title": "Self-Attention",
      "summary": "현재 위치에서 어떤 토큰의 정보를 얼마나 모을지 가중치를 계산합니다. 생성형 모델에서는 미래 토큰을 보지 못하도록 제한합니다. 여러 어텐션 헤드가 서로 다른 방식으로 문맥을 반영할 수 있습니다.",
      "kind": "concept",
      "position": {
        "x": 680,
        "y": 490
      },
      "parentId": "language-model",
      "document": "attention.md"
    },
    {
      "status": "exploring",
      "tags": [],
      "id": "feed-forward",
      "title": "Feed-forward network",
      "summary": "어텐션이 모은 정보를 각 위치의 신경망이 다시 변환합니다. 같은 층에서는 위치마다 같은 가중치를 사용하지만 입력 벡터가 달라 결과도 달라집니다. 잔차 연결과 정규화가 함께 계산을 이어줍니다.",
      "kind": "concept",
      "position": {
        "x": 1060,
        "y": 490
      },
      "parentId": "language-model",
      "document": "feed-forward.md"
    },
    {
      "status": "exploring",
      "tags": [],
      "id": "query-key-value",
      "title": "Query · Key · Value",
      "summary": "같은 입력 표현에서 세 종류의 벡터를 만듭니다. Query와 Key를 비교해 참고 비중을 구하고, 그 비중으로 Value를 섞습니다. 검색어·이름표·내용이라는 비유를 실제 숫자 계산과 연결합니다.",
      "kind": "concept",
      "position": {
        "x": 680,
        "y": 770
      },
      "parentId": "language-model",
      "document": "query-key-value.md"
    },
    {
      "status": "exploring",
      "tags": [],
      "id": "training",
      "title": "이 능력은 어떻게 만들어지나요?",
      "summary": "위쪽은 답변 한 번을 생성하는 과정입니다. 여기서는 그 계산에 쓰이는 가중치를 미리 학습하고, 완성된 모델을 사용하는 흐름을 살펴봅니다.",
      "kind": "group",
      "position": {
        "x": 0,
        "y": 1180
      },
      "size": {
        "width": 1300,
        "height": 490
      },
      "document": "training.md"
    },
    {
      "status": "exploring",
      "tags": [],
      "id": "pretraining",
      "title": "사전 학습",
      "summary": "많은 텍스트에서 다음 토큰을 맞히도록 모델의 가중치를 조정합니다. 정답 토큰에 낮은 확률을 주면 손실이 커지고, 역전파와 최적화로 조금씩 수정합니다. 이 과정을 반복하며 언어의 패턴을 학습합니다.",
      "kind": "concept",
      "position": {
        "x": 40,
        "y": 180
      },
      "parentId": "training",
      "document": "pretraining.md"
    },
    {
      "status": "exploring",
      "tags": [],
      "id": "post-training",
      "title": "후속 학습",
      "summary": "사전 학습 모델에 질문·답변 예시를 학습시키고, 응답에 대한 선호 신호 등으로 행동을 다듬습니다. 지시를 따르는 능력과 응답 품질을 개선하는 단계이며, 구체적인 학습 방식은 모델마다 다릅니다.",
      "kind": "concept",
      "position": {
        "x": 460,
        "y": 180
      },
      "parentId": "training",
      "document": "post-training.md"
    },
    {
      "status": "exploring",
      "tags": [],
      "id": "learning-question",
      "title": "추론 — 학습한 값으로 실행",
      "summary": "학습된 가중치를 사용해 새 입력에 대한 토큰을 생성합니다. 일반적인 대화 추론에서는 질문할 때마다 가중치를 고치지 않습니다. 대화 내용이 문맥에 추가되는 것과 모델 자체가 학습되는 것은 다릅니다.",
      "kind": "concept",
      "position": {
        "x": 880,
        "y": 180
      },
      "parentId": "training",
      "document": "learning-question.md"
    }
  ],
  "edges": [
    {
      "id": "tokens-to-vectors",
      "source": "tokenization",
      "target": "embedding",
      "relation": "sequence"
    },
    {
      "id": "vectors-to-context",
      "source": "embedding",
      "target": "transformer",
      "relation": "sequence"
    },
    {
      "id": "context-to-output",
      "source": "transformer",
      "target": "generation",
      "relation": "sequence"
    },
    {
      "id": "transformer-attention",
      "source": "transformer",
      "target": "attention",
      "relation": "hierarchy"
    },
    {
      "id": "transformer-feed-forward",
      "source": "transformer",
      "target": "feed-forward",
      "relation": "hierarchy"
    },
    {
      "id": "attention-qkv",
      "source": "attention",
      "target": "query-key-value",
      "relation": "hierarchy"
    },
    {
      "id": "pretraining-post-training",
      "source": "pretraining",
      "target": "post-training",
      "relation": "sequence"
    },
    {
      "id": "post-training-inference",
      "source": "post-training",
      "target": "learning-question",
      "relation": "sequence"
    }
  ]
}
